{
  "event_id": "0192f5f0-5555-7000-8000-00000000000a",
  "type": "video.visibility_changed",
  "version": 1,
  "occurred_at": "2026-10-02T12:00:00Z",
  "producer": "video-svc",
  "data": {
    "video_id": "0192f5e4-7c1a-7b3e-9d2a-5f6e7a8b9c0d",
    "owner_id": "0192f5e0-0000-7000-8000-000000000001",
    "visibility": "PRIVATE"
  }
}
