{
  "event_id": "0192f5f0-7777-7000-8000-0000000000a2",
  "type": "social.post.video_released",
  "version": 1,
  "occurred_at": "2026-10-28T15:00:00Z",
  "producer": "social-svc",
  "data": {
    "post_id": "019a3000-0000-7000-8000-000000000001",
    "video_id": "019a3000-0000-7000-8000-000000000002",
    "author_id": "0192f5e0-0000-7000-8000-000000000001"
  }
}
